A1: =Data!A1 -> Дата | B1: =Data!B1 -> 37746 | C1: =Data!C1 -> 37753 | D1: =Data!D1 -> 37760
A2: =Data!A2 -> Епишин | C2: =(Data!C2-Data!B2)/((NETWORKDAYS(B$1,C$1)-1)*8) -> 0.95 | D2: =(Data!D2-Data!C2)/((NETWORKDAYS(C$1,D$1)-1)*8) -> 1.3
A3: =Data!A3 -> Тяглов | C3: =(Data!C3-Data!B3)/((NETWORKDAYS(B$1,C$1)-1)*8) -> 0.65 | D3: =(Data!D3-Data!C3)/((NETWORKDAYS(C$1,D$1)-1)*8) -> 0.6
A4: =Data!A4 -> Петухов | C4: =(Data!C4-Data!B4)/((NETWORKDAYS(B$1,C$1)-1)*8) -> 0.4 | D4: =(Data!D4-Data!C4)/((NETWORKDAYS(C$1,D$1)-1)*8) -> 0.6
A5: =Data!A5 -> Валенсия | C5: =(Data!C5-Data!B5)/((NETWORKDAYS(B$1,C$1)-1)*8) -> 0.85 | D5: =(Data!D5-Data!C5)/((NETWORKDAYS(C$1,D$1)-1)*8) -> 1