A1: =Data!A1 -> Дата | B1: =Data!B1 -> 37746 | C1: =Data!C1 -> 37753 | D1: =Data!D1 -> 37760
A2: =Data!A2 -> Епишин | D2: =(V!D2-V!C2)/((NETWORKDAYS(C$1,D$1)-1)*8) -> 8.7500000000000008E-3
A3: =Data!A3 -> Тяглов | D3: =(V!D3-V!C3)/((NETWORKDAYS(C$1,D$1)-1)*8) -> -1.25E-3
A4: =Data!A4 -> Петухов | D4: =(V!D4-V!C4)/((NETWORKDAYS(C$1,D$1)-1)*8) -> 5.0000000000000001E-3
A5: =Data!A5 -> Валенсия | D5: =(V!D5-V!C5)/((NETWORKDAYS(C$1,D$1)-1)*8) -> 3.7499999999999999E-3