A1: =TODAY() -> 37761 | B1: 25
B2: Сделано | C2: Всего по MSP | D2: Всего | E2: Осталось | G2: Запас
A3: Епишин | B3: =HLOOKUP($A$1,Data!$A$1:$Z$5,ROW(A3)-1) -> 140 | C3: 260 | D3: =C3-G3 -> 180 | E3: =D3-B3 -> 40 | G3: =5*8*2 -> 80
A4: Тяглов | B4: =HLOOKUP($A$1,Data!$A$1:$Z$5,ROW(A4)-1) -> 200 | C4: 352 | D4: =C4-G4 -> 272 | E4: =D4-B4 -> 72 | G4: =G3 -> 80
A5: Петухов | B5: =HLOOKUP($A$1,Data!$A$1:$Z$5,ROW(A5)-1) -> 160 | C5: 264 | D5: =C5-G5 -> 184 | E5: =D5-B5 -> 24 | G5: =G3 -> 80
A6: Валенсия | B6: =HLOOKUP($A$1,Data!$A$1:$Z$5,ROW(A6)-1) -> 224 | C6: 328 | D6: =C6-G6 -> 248 | E6: =D6-B6 -> 24 | G6: =G3 -> 80
A8: Препродакшн | B8: =SUM(B3:B6) -> 724 | C8: =SUM(C3:C6) -> 1204 | D8: =SUM(D3:D6) -> 884 | E8: =D8-B8 -> 160